{
  "snapshotId": "card-expected",
  "teamId": "card",
  "asOf": "2026-09-09T16:00:00Z",
  "timezone": "Europe/Moscow",
  "catalogVersion": 1,
  "metricVersions": {
    "classification": 1
  },
  "inputHashes": {
    "calendar": "hand",
    "workflow": "hand",
    "taxonomy": "hand",
    "scope": "hand",
    "bundle": "hand"
  },
  "coverage": {
    "timing": "full",
    "unknownPct": 33.333333333333336,
    "storyPoints": "full",
    "assigneeMatchPct": 100,
    "membership": "complete"
  },
  "sprint": {
    "id": "s",
    "start": "2026-09-07",
    "end": "2026-09-18",
    "metrics": [],
    "issues": []
  },
  "period": {
    "id": "2026-09",
    "start": "2026-09-07",
    "end": "2026-09-30",
    "metrics": [
      {
        "id": "classification",
        "version": 1,
        "unit": "percent",
        "value": 33.333333333333336,
        "excluded": [
          {
            "issueKey": "K-1",
            "reason": "unknown"
          },
          {
            "issueKey": "U-1",
            "reason": "unknown"
          }
        ],
        "warnings": [
          "unknown-above-threshold"
        ],
        "params": {
          "unknownWarnPct": 15
        },
        "population": [
          "A-1",
          "B-1",
          "D-1",
          "L-1"
        ],
        "detail": {
          "paths": [
            {
              "issueKey": "A-1",
              "headId": "p-1",
              "category": "project",
              "subtype": null,
              "reason": "head"
            },
            {
              "issueKey": "B-1",
              "headId": "p-1",
              "category": "project",
              "subtype": null,
              "reason": "head"
            },
            {
              "issueKey": "D-1",
              "headId": "p-1",
              "category": "project",
              "subtype": null,
              "reason": "head"
            },
            {
              "issueKey": "K-1",
              "headId": null,
              "category": "unknown",
              "subtype": null,
              "reason": "unknown"
            },
            {
              "issueKey": "L-1",
              "headId": "p-1",
              "category": "project",
              "subtype": null,
              "reason": "head"
            },
            {
              "issueKey": "U-1",
              "headId": null,
              "category": "unknown",
              "subtype": null,
              "reason": "unknown"
            }
          ]
        },
        "explain": "Голова эпика важнее метки. Без головы и без явной метки — unknown. Порог плашки 15.0%. Версия 1."
      }
    ]
  }
}
