{
  "snapshotId": "card-expected",
  "teamId": "card",
  "asOf": "2026-09-08T07:00:00Z",
  "timezone": "Europe/Moscow",
  "catalogVersion": 1,
  "metricVersions": {
    "statusHours": 1
  },
  "inputHashes": {
    "calendar": "hand",
    "workflow": "hand",
    "taxonomy": "hand",
    "scope": "hand",
    "bundle": "hand"
  },
  "coverage": {
    "timing": "full",
    "unknownPct": 100,
    "storyPoints": "full",
    "assigneeMatchPct": 100,
    "membership": "complete"
  },
  "sprint": {
    "id": "s",
    "start": "2026-09-07",
    "end": "2026-09-18",
    "metrics": [],
    "issues": []
  },
  "period": {
    "id": "2026-09",
    "start": "2026-09-08",
    "end": "2026-09-30",
    "metrics": [
      {
        "id": "statusHours",
        "version": 1,
        "unit": "ratio",
        "value": null,
        "excluded": [],
        "warnings": [],
        "params": {
          "nominalSeconds": 28800
        },
        "detail": {
          "parallelism": null,
          "inheritedSeconds": 0,
          "ownSeconds": 0,
          "days": []
        }
      }
    ]
  }
}
